{
  "$schema": "https://json-schema.org/draft/2020-12/schema",
  "$id": "https://github.com/AgentiX-E/microglia/packages/eval/schema/run-artifact.schema.json",
  "title": "Microglia run artefact",
  "description": "One benchmark run: the generator that produced it, the cases it scored, the metrics those cases imply, and the gates that judged them. Published so that a reader who does not run our code can validate a result, and so that `validateRunArtifact` has a written counterpart. The JSON Schema covers shape; the validator additionally checks that the metrics are the cases, counted.",
  "type": "object",
  "additionalProperties": false,
  "required": [
    "schema",
    "id",
    "generatedAt",
    "prereg",
    "generator",
    "protocol",
    "cases",
    "metrics",
    "gates"
  ],
  "properties": {
    "schema": { "const": "microglia.run-artifact/1" },
    "id": { "type": "string", "minLength": 1 },
    "generatedAt": {
      "type": "string",
      "format": "date-time",
      "pattern": "^\\d{4}-\\d{2}-\\d{2}T\\d{2}:\\d{2}:\\d{2}(\\.\\d+)?Z$"
    },
    "prereg": {
      "type": ["string", "null"],
      "description": "The id of the pre-registration this run executes, or null when the run has none. A null here is a run nobody predicted the outcome of."
    },
    "generator": { "$ref": "#/$defs/generator" },
    "protocol": { "$ref": "#/$defs/protocol" },
    "cases": { "type": "array", "minItems": 1, "items": { "$ref": "#/$defs/case" } },
    "metrics": { "$ref": "#/$defs/metrics" },
    "gates": { "type": "array", "minItems": 1, "items": { "$ref": "#/$defs/gate" } }
  },
  "$defs": {
    "generator": {
      "type": "object",
      "additionalProperties": false,
      "required": ["contract", "name", "version", "source"],
      "properties": {
        "contract": { "const": "candidate-generator/1" },
        "name": { "type": "string", "minLength": 1 },
        "version": { "type": "string", "minLength": 1 },
        "source": {
          "type": "string",
          "minLength": 1,
          "description": "Path of the module, relative to the repository root."
        }
      }
    },
    "protocol": {
      "type": "object",
      "additionalProperties": false,
      "required": ["comparison", "cases", "concurrency"],
      "properties": {
        "comparison": { "enum": ["multiset", "set"] },
        "cases": { "type": "integer", "minimum": 1 },
        "concurrency": { "type": "integer", "minimum": 1 }
      }
    },
    "case": {
      "type": "object",
      "additionalProperties": false,
      "required": ["id", "dbId", "sql", "error", "correct"],
      "properties": {
        "id": { "type": "string", "minLength": 1 },
        "dbId": { "type": "string", "minLength": 1 },
        "sql": {
          "type": ["string", "null"],
          "description": "The generator's answer, or null when it produced none."
        },
        "error": {
          "type": ["string", "null"],
          "description": "Why there is no answer. Exactly one of sql and error is set."
        },
        "correct": { "type": "boolean" }
      },
      "oneOf": [
        {
          "required": ["sql"],
          "properties": { "sql": { "type": "string", "minLength": 1 }, "error": { "type": "null" } }
        },
        {
          "required": ["error"],
          "properties": { "sql": { "type": "null" }, "error": { "type": "string", "minLength": 1 } }
        }
      ]
    },
    "metrics": {
      "type": "object",
      "additionalProperties": false,
      "required": ["n", "answered", "correct", "accuracy", "low", "high", "byDatabase"],
      "properties": {
        "n": { "type": "integer", "minimum": 1 },
        "answered": { "type": "integer", "minimum": 0 },
        "correct": { "type": "integer", "minimum": 0 },
        "accuracy": { "type": "number", "minimum": 0, "maximum": 1 },
        "low": { "type": "number", "minimum": 0, "maximum": 1 },
        "high": { "type": "number", "minimum": 0, "maximum": 1 },
        "byDatabase": {
          "type": "array",
          "minItems": 1,
          "items": {
            "type": "object",
            "additionalProperties": false,
            "required": ["dbId", "n", "correct"],
            "properties": {
              "dbId": { "type": "string", "minLength": 1 },
              "n": { "type": "integer", "minimum": 1 },
              "correct": { "type": "integer", "minimum": 0 }
            }
          }
        }
      }
    },
    "gate": {
      "type": "object",
      "additionalProperties": false,
      "required": ["code", "name", "ok", "detail"],
      "properties": {
        "code": { "type": "string", "pattern": "^V[0-9]+$" },
        "name": { "type": "string", "minLength": 1 },
        "ok": { "type": "boolean" },
        "detail": { "type": "string", "minLength": 1 }
      }
    }
  }
}
